Textos_espanol,sdg
"Una definicin establecida de presupuestos de gnero se refiere a una evaluacin de los presupuestos basada en el gnero, que incorpora una perspectiva de gnero en todos los niveles del proceso presupuestario y reestructura los ingresos y los gastos para promover la igualdad de gnero (Consejo de Europa, 2009). La naturaleza y la calidad de estos enfoques parecen bastante variables, y van desde una declaracin pro forma de impactos sobre la igualdad de gnero adjunta a todas las nuevas polticas que se presentan ante el gobierno, hasta evaluaciones de impacto de gnero ms estructuradas y sistemticas. Unos pocos pases informaron que la igualdad de gnero est ""transversalizadora"" en el sentido de que la responsabilidad recae en los ministerios sectoriales para promover esta agenda dentro de sus respectivos dominios de polticas y, en consecuencia, no se prev un papel particular para el proceso presupuestario como necesario.",5
"Los datos se refieren a 2000-10 para Estonia y Finlandia, a 1999-2010 para Francia y a 2002-09 para Mxico. Los datos se refieren a 1997-2006 para Australia, 1995-2006 para los Pases Bajos, 1995-2005 para el Reino Unido y 1992-2002 para Alemania. Para obtener detalles sobre la definicin de trabajo no remunerado y trabajo total, vase Miranda, V. (2011), Cooking, Caring and Volunteering: Unpaid Work around the World"", Documentos de Trabajo sobre Social, Empleo y Migracin de la OCDE, nm.",5
"Adems, el objetivo de la Ley es contrarrestar la discriminacin directa e indirecta por motivos de gnero"". (Statistics Greenland public recientemente un estudio sobre ingresos en 2013 (Statistics Greenland 2014). La diferencia general, aproximadamente un tercio a favor de los hombres, no solo refleja diferencias de gnero, pero tambin diferencias en educacin y posicin en las diferentes jerarquas, as como el hecho de que los hombres estn sobrerrepresentados en grupos de edad caracterizados por mayores ingresos.",5
"Las estimaciones de las ecuaciones 2-5 confirman los vnculos indirectos entre el nivel de discriminacin por motivos de gnero en las instituciones sociales y los ingresos. El cuadro 5 muestra una fuerte relacin negativa y significativa entre el SIGI y la productividad total de los factores, la fuerza laboral y el capital humano, cualquiera que sea la especificacin utilizada (los anexos E, F y G presentan los resultados completos de la regresin). Los coeficientes SIGI siguen siendo significativamente negativos mientras se introducen variables de control adicionales, se controla la posible endogeneidad y se realizan verificaciones de robustez.",5
"La orientacin profesional debe proporcionar una imagen completa de las distintas vas del sistema educativo, que abarque en particular la opcin de formacin profesional. La orientacin en educacin y formacin profesional tiene un papel importante que desempear para ayudar a las personas a identificar cmo pueden utilizar mejor las habilidades que han desarrollado a lo largo de su curso de educacin y formacin para construir carreras satisfactorias. La orientacin profesional en las universidades puede respaldar transiciones efectivas al lugar de trabajo al involucrar a los empleadores (incluso a travs de ferias profesionales y talleres para empleadores) para brindar oportunidades de aprendizaje relacionadas con el trabajo, y puede ayudar a garantizar que las habilidades de los graduados sean bien utilizadas.",4
"Los problemas de salud mental tambin se incluyen en parte del trabajo en otras partes de los ministerios (ms all de la Divisin de Bienestar y Salud Mental), por ejemplo, en la poltica de empleo se presta atencin a los problemas de salud mental en reas como el empleo de apoyo y el regreso al trabajo, y En educacin. Este marco legal es una de las dos herramientas clave del gobierno central para promulgar cambios en lnea con la direccin de la poltica. A travs de esta Ley, que se analiza en detalle en el Captulo 1, el MHLW indica la direccin de la poltica nacional y asegura el financiamiento requerido.",5
"Es ms probable que la invocacin de los derechos individuales e inclusivos tenga un impacto de desecuritizacin, mientras que la reivindicacin de derechos exclusivos para un grupo puede resultar en una mayor violacin de los derechos humanos. Las dimensiones individual/colectiva e inclusiva/exclusiva de la formulacin de derechos son muy importantes para el gnero, tanto en tiempos de paz3 como en tiempos de guerra. Esta definicin apunta a una interdependencia de los niveles individual/colectivo, ya que las reivindicaciones de los derechos humanos de las mujeres dependen tanto de los derechos individuales como de una identidad colectiva. En el contexto de la guerra, las reivindicaciones colectivas de los derechos de las mujeres, especialmente cuando se invocan exclusivamente, pueden tener impactos de seguridad al reificar las identidades de gnero y jugar con las estrategias etnopolticas.",5
"Esto sugiere que pagar a los proveedores en funcin de la cantidad de actividades que se realizan da un fuerte incentivo a los hospitales para extender las estadas de los pacientes. Adems, la prestacin de atencin a largo plazo en los hospitales tambin aumenta la duracin media de la estancia (Jones, 2010). Como resultado, los proveedores de atencin primaria tienen un incentivo financiero para convertirse en mini hospitales que brindan procedimientos quirrgicos, a menudo cuando no son apropiados o seguros.",3
"La primera sesin se organiza en septiembre e incluye una prueba de conocimientos de los alumnos. La ltima tiene lugar en abril y tambin incluye una prueba. Las pruebas se utilizan de dos formas: permiten la evaluacin de las necesidades de los alumnos y la posterior elaboracin de un plan de actividades formativas adaptadas a alumnos concretos, y tambin permiten la evaluacin del progreso de los alumnos durante el curso escolar.",4
"La Seccin 3 investiga estrategias para promover una formacin profesional de calidad, incluidos los aprendizajes, mientras que la Seccin 4 se centra en el apoyo a los estudiantes en riesgo. Para una descripcin ms detallada y una evaluacin del sistema educativo de Letonia, vase OCDE (2015e). El Ministerio de Educacin y Ciencia (MoES) nacional tiene la funcin de supervisin y, a travs del Centro Nacional de Educacin subordinado, establece los estndares educativos nacionales y determina los planes de estudio y los procedimientos de examen. Proporciona el marco regulatorio para la provisin de educacin vocacional y emplea a los directores de los establecimientos VET.1 Tambin mantiene el registro de estndares ocupacionales y estudia las demandas de habilidades del mercado laboral.",4
"La seccin tambin explora cmo se distribuyen las responsabilidades de evaluacin en diferentes pases y cmo interactan los diferentes niveles de gobierno para formar un sistema de evaluacin coherente. Esto incluye el alcance de la evaluacin, es decir, las reas de aprendizaje que cubre la evaluacin, as como las caractersticas procesales clave de la evaluacin de los estudiantes en todos los pases, es decir, la combinacin de instrumentos utilizados en sistemas especficos de evaluacin de estudiantes, el formato de las evaluaciones y el uso de las TIC en la evaluacin. Tambin revisa las formas en que el diseo de las evaluaciones puede mejorar o amenazar la justicia y la equidad en la educacin. Incluye temas tales como: las capacidades que los estudiantes necesitan para participar y aprender de su evaluacin, las competencias de evaluacin que los docentes adquieren en la formacin docente inicial, desarrollo profesional y arreglos de moderacin, y la experiencia de las agencias involucradas en la evaluacin de los estudiantes. Describe los estndares de calidad y los formatos de informes utilizados en diferentes contextos, revisa los marcos legales vigentes para regular los informes de resultados y analiza las formas en que los resultados de la evaluacin se utilizan en diferentes contextos para registrar informacin, brindar retroalimentacin a los estudiantes y tomar decisiones sobre su desempeo. trayectoria educativa posterior.",4
"A pesar de la importancia de capturar la multitarea para capturar la intensidad con la que las mujeres emplean el tiempo, no existe un estndar internacional sobre cmo medir las actividades simultneas. La base de datos de uso del tiempo de la OCDE tiene como objetivo mejorar la comparabilidad entre los pases de la OCDE (ver Cuadro 3). Con base en esta metodologa, la OCDE ha realizado un anlisis en cuatro pases adicionales para explorar los impactos del trabajo de cuidado no remunerado en contextos de ingresos bajos y medios: Sudfrica, Per, Etiopa y Bangladesh (ver Anexo A).",5
"Sin embargo, un gran nmero de estos pases no cuentan con leyes especficas que prohban la discriminacin en el pago y la contratacin por motivos de gnero y embarazo (WBL Database, 2016). De hecho, los nicos pases que cuentan con dicha legislacin son Chile, Costa Rica, Egipto, Indonesia, la Federacin Rusa y Tnez. La evidencia existente de los pases de la OCDE muestra que el pblico a menudo est mal informado sobre los derechos de los trabajadores (OCDE, 2008, Captulo 3).",5
"La siguiente tabla ilustra cmo las diferentes pedagogas establecidas tienden a conducir a diferentes tipos de experiencias de aprendizaje. La combinacin de pedagogas que comparten prcticas comunes puede ayudar a reducir las ventajas y desventajas de usar demasiadas pedagogas. Por ejemplo, en una escuela donde los estudiantes practican el aprendizaje basado en la indagacin, los maestros pueden sentirse ms seguros al combinar su enfoque con desafos o proyectos complejos, sabiendo que los estudiantes son competentes para administrar su propio aprendizaje. Estudiar combinaciones comunes de pedagogas puede ayudar a identificar aquellas prcticas que son comunes a varias pedagogas, como presentaciones de aprendizaje o autoevaluacin de los estudiantes.",4
"Las empresas farmacuticas no siempre buscan la proteccin de patentes en todos los pases debido, entre otras cosas, a la percepcin de falta de tamao del mercado. Por lo tanto, es posible que en algunos pases, a pesar de la existencia de una ley nacional de patentes, ciertas sustancias farmacuticas permanezcan sin patente y puedan usarse, fabricarse e importarse libremente en ese pas. Si el inventor original cambia de opinin y busca la proteccin de la patente en un momento posterior, la solicitud sera rechazada por falta de novedad si la sustancia en cuestin se ha puesto a disposicin del pblico antes de la presentacin de la solicitud de patente.",5
"La Superintendencia de Educacin tambin est integrada dentro del Sistema Nacional de Aseguramiento de la Calidad (Sistema Nacional de Aseguramiento de la Calidad, SAC), que brinda el potencial para vincular el monitoreo del uso de recursos con la calidad de la educacin. La SAC brinda un marco institucional muy til para promover un uso ms efectivo de los recursos. Es un sistema relativamente nuevo que complementa otros mecanismos para la rendicin de cuentas institucional que Chile ha desarrollado a lo largo del tiempo, incluyendo un sistema de evaluacin docente, evaluaciones por parte de la Secretara de Hacienda (Direccin de Presupuestos, DIPRES), datos detallados e informacin distribuida al pblico, entre otros. otros. A medida que crece y se desarrolla ms plenamente con el tiempo, los efectos del SAC se sentirn ms plenamente.",5
"La supervisin eficaz del personal es fundamental para la mejora continua de los servicios de EAPI, lo que indica la importancia de vincular la supervisin del personal con el desarrollo profesional. Junto con la calidad del servicio, es el rea monitoreada con ms frecuencia, tanto para mejorar el nivel de calidad del servicio como para informar la formulacin de polticas. Adems, se monitorea el desempeo del personal para identificar si necesita alguna mejora. Las encuestas para padres, las revisiones por pares y las pruebas del personal son menos populares.",4
"Esto es comparable al promedio del G7 y la OCDE, pero es significativamente ms alto que en Francia, donde el 20 % de los bebedores ms empedernidos consume solo alrededor de la mitad de todo el alcohol (OCDE, 2015). Los datos de Australia, el Reino Unido y los Estados Unidos son de 2012 en lugar de 2013. A pesar de una disminucin en la tasa de suicidios en 2012, que segn los datos estimados de las autoridades coreanas continu en 2013 pasando de 29,1 por 100 000 habitantes en 2012 a 28,7 en 2013 (Ministerio de Salud de Corea, 2016), el suicidio sigue siendo una de las principales causas de muerte entre los adolescentes de Corea.",3
"La tarea de administrar la infraestructura es particularmente difcil ya que la capacidad de la junta escolar as como la capacidad de recaudar fondos de la comunidad local es a menudo menor en las reas rurales, mientras que muchos edificios escolares estn en muy malas condiciones ya que la mayora de ellos fueron construido entre los aos 50 y 70. Las cien escuelas primarias con el desempeo ms bajo del pas, medido por los niveles de repitencia y desercin, tienen menos de 50 alumnos y estn ubicadas en su mayora en zonas rurales fuera del rea de la capital (PEN, 2013). Tambin hay indicios de que los estudiantes de escuelas primarias pequeas tienen menos probabilidades de hacer la transicin a la escuela secundaria.",4
"La tasa de alfabetizacin de adultos mide la alfabetizacin entre personas de 15 aos o ms, y la tasa de alfabetizacin de jvenes mide la alfabetizacin entre personas de 15 a 24 aos. Clculos agregados para tasas de alfabetizacin de adultos: UIS. Recopilados de registros escolares de tasa de supervivencia, encuestas o censos escolares, censos nacionales de poblacin y encuestas de hogares y fuerza laboral. Datos obtenidos: mayo y junio de 2013.",5
"Tambin tienen un impacto directo en la capacidad de las mujeres para acceder a los recursos y controlarlos. Algunos de estos pases, incluidos Marruecos, la Repblica de Corea y Turqua, comenzaron el perodo con amplias disposiciones discriminatorias, pero desde entonces han avanzado significativamente hacia leyes de familia con mayor igualdad de gnero. Sin embargo, a partir de 2005, ocho pases (Argelia, Bangladesh, Egipto, la Repblica Islmica de Irn, Jordania, Malasia, Pakistn y Arabia Saudita) han mantenido leyes altamente discriminatorias que, por ejemplo, respaldan la autoridad de los hombres sobre las mujeres en el matrimonio, dan a los hombres mayores derechos sobre la propiedad y limitan la capacidad de las mujeres para solicitar el divorcio.15 Estos pases abarcan diferentes regiones, pero todos aplican una interpretacin conservadora de la ley de familia islmica. En 1993 se llevaron a cabo reformas menores de la ley de familia, pero se resistieron cambios importantes.",5
"En 2010, las tasas de participacin de las mujeres en la fuerza laboral se mantuvieron por debajo del 30 por ciento en el norte de frica y Asia occidental, por debajo del 40 por ciento en el sur de Asia y por debajo del 50 por ciento en el Caribe y Amrica Central. La brecha entre las tasas de participacin de mujeres y hombres se ha reducido ligeramente en los ltimos 20 aos, pero sigue siendo considerable. Las brechas de gnero ms pequeas se encuentran en los primeros aos de la edad adulta y las ms amplias en las edades laborales ptimas. En las economas ms desarrolladas, la mano de obra, especialmente la mano de obra femenina, se emplea predominantemente en los servicios.",5
"Adems, el artculo 28, prrafo 2 de la convencin adopta el principio de inadmisibilidad contenido en la Convencin de Viena sobre el Derecho de los Tratados, que establece que no se permitir una reserva incompatible con el objeto y fin de una convencin. Ha instado sistemticamente a los Estados partes a que los retiren y se aseguren de que sus sistemas jurdicos se ajusten a la convencin en general y al artculo 16 en particular. El comit ha enfatizado que el Artculo 16 (entre otros) es central para el objeto y propsito de la convencin y que las reservas impactan negativamente en el disfrute de los derechos de las mujeres. Como tal, las reservas al Artculo 16 contradicen los principios fundamentales de la convencin de igualdad entre hombres y mujeres, y puede socavar los esfuerzos de los pases para lograr la igualdad de gnero.",5
"La Universidad de Maastricht aplica PBL en todos sus programas con el objetivo de generar estudiantes que sean independientes y emprendedores para resolver problemas. La universidad emplea varias versiones de PBL como modelo educativo que simula un entorno de trabajo orientado a la investigacin que brinda a los estudiantes habilidades que llevarn consigo en sus carreras. Por ejemplo, la Facultad de Salud, Medicina y Ciencias de la Vida de Maastricht fue una de las primeras universidades en Europa en implementar PBL como la estrategia educativa dominante en la educacin mdica. La Escuela de Negocios y Economa de la Universidad de Maastricht ha estado utilizando PBL en todos sus programas de grado durante ms de 20 aos.",5
"Revista de poltica y economa de la salud mental, vol. Jahrhunderts (Exclusin social de las personas con trastornos mentales. Equilibrio y perspectiva de la psiquiatra comunitaria a principios del siglo XXI), Fortschritte der Neurologie-Psychiatrie, vol. Repper (2000), Empleo, Inclusin Social y Salud Mental, Journal of Psychiatric and Mental Health Nursing, vol.",3
"El puesto adicional de vicepresidente de los Upazila Parishads del pas se cre exclusivamente para candidatas. Los candidatos son elegidos por voto directo, aunque el cargo est reservado para mujeres (The Daily Star 2009). Sin embargo, las vicepresidentas de Upazila Parishads en todo el pas no pudieron comenzar sus funciones despus de las elecciones de 2009, ya que el gobierno no emiti una circular sobre los puestos recin creados.",5
"Tambin tienen altas tasas de analfabetismo: en 2010, el 34,5% de las mujeres indgenas eran analfabetas (SEP, 2015). Sin embargo, estas tasas han ido mejorando entre cohortes: para 2015, solo el 1,2% de las mujeres de 15 a 29 aos eran analfabetas (datos de INMUJERES proporcionados a la OCDE). Mxico tambin tiene un desempeo inferior en lectura: el puntaje promedio de Mxico est 72 puntos por debajo del promedio de la OCDE. El porcentaje de nios y nias de bajo rendimiento en Mxico tambin es el doble del porcentaje promedio en la OCDE en todas las materias, pero las cifras pueden ocultar diferencias an mayores, muchos jvenes de 15 aos desfavorecidos abandonan la escuela y, por lo tanto, no son captados por estas estadsticas.",5
"Las barreras sociales incluyen la falta de conocimiento de sus derechos, el analfabetismo, la falta de informacin y la dependencia de familiares varones para recibir asistencia y recursos. Filipinas (Comit para la Eliminacin de la Discriminacin contra la Mujer, comunicacin No. Segn el Comit, del fallo se desprende claramente que la evaluacin de la credibilidad de la versin de los hechos de la autora estuvo influida por una serie de estereotipos, la autora en esta situacin no haber seguido lo que se esperaba de una ""vctima ideal"" y racional o lo que el juez consider que era la respuesta ideal y racional de una mujer en una situacin de violacin. Adems de ordenar al Estado parte el pago de una indemnizacin adecuada, el Comit orden la Estado a ""garantizar que todos los procedimientos legales en casos relacionados con delitos de violacin y otros delitos sexuales sean imparciales y justos, y no estn afectados por prejuicios o nociones estereotipadas de gnero"".",5
"Las actividades operativas relacionadas con la educacin vocacional formal y no formal estn bajo la responsabilidad de los gobiernos distritales o municipales. Idealmente, un distrito podra amalgamar la provisin vocacional en un SMK super que ofrezca una variedad de materias. Sin embargo, casi todas las escuelas SMK revisadas por el equipo permanecieron en gran medida enfocadas en sus ofertas histricas de materias. Dada la alta inversin de capital requerida para la educacin vocacional, muchas escuelas se han visto limitadas en los cursos que pueden ofrecer por sus instalaciones y equipos heredados. Otra innovacin adoptada por el ministerio en 2014 fue la introduccin de la Iniciativa de Escuela Modelo Vocacional, que establece una sper escuela SMK como escuela modelo, con ms recursos, que puede actuar como un centro para escuelas satlite. Actualmente hay 90 escuelas de este tipo, pero la intencin es crear 1 650 para 2020.",4
"La tasa TEA impulsada por la oportunidad es 78% en Uruguay, 71% en Chile y el Estado Plurinacional de Bolivia, 69% en Per, 68% en Ecuador, 61% en Brasil y 59% en Colombia y Argentina (Kelley y otros, 2015 ). Emprendimiento de mujeres, Global Entrepreneurship Monitor (GEM), 2015. Los datos por pas indican que la participacin de mujeres empleadoras en la fuerza laboral oscil entre un mnimo de entre 1,7% y 2,3% en Argentina, Repblica Bolivariana de Venezuela, Ecuador y Uruguay. a un mximo de 4,9% en Paraguay. Si bien estos empleadores son un grupo heterogneo que opera empresas de diferentes tamaos, composicin y origen, la gran mayora de las empresas de mujeres empresarias emplean a menos de cinco trabajadores (OIT, 2014d). Sin embargo, hasta el momento se sabe muy poco sobre ellos.",5
"La medida ms urgente consiste en poner en marcha una infraestructura de informacin integrada que permita decelerar las disfunciones y garantizar la libre circulacin de la informacin entre los prestatarios, los pacientes y las estructuras. Au niveau des cabinets medicaux, la participacin de los pacientes a la medida y la notificacin de disfonctionnements est essentielle. La reussite des esfuerzos permanentes mis en ceuvre pour ameliorer la securite passe par une culture active de la securite, axee sur l'amelioration colectivo et le travail d'equipe.",3
"La Estrategia Nacional de Desarrollo Sostenible 2013-2020-2030 incluye una gama adicional de actividades que buscan reducir los riesgos ambientales y mejorar la salud y el bienestar. Rumania tiene algunos de los niveles ms altos de resistencia a los antimicrobianos en la UE. Los datos de vigilancia muestran que en 2015, el 24,7 % de las infecciones del torrente sanguneo por Klebsiella pneumoniae eran resistentes a los carbapenmicos, una importante clase de antibiticos de ltima lnea para tratar infecciones bacterianas. Este porcentaje es mucho ms alto que la mediana de la UE/EEE (0,5 %) y el tercero ms alto de la UE/EEE (ECDC, 2017b).",3
"Las asociaciones deben incluir organismos comunitarios locales, empresas e instituciones culturales, incluidos museos y bibliotecas. Los socios extrados de la educacin superior son fundamentales para ampliar los horizontes de aprendizaje tanto de los estudiantes como del personal y ofrecer experiencia adicional en el proceso constante de desarrollo. Igualmente importantes son las asociaciones con otras escuelas y entornos de aprendizaje a travs de redes y aprendizaje profesional.",4
"Las brechas entre hombres y mujeres difieren considerablemente segn la raza, la brecha ms alta entre hombres y mujeres fue para los estudiantes afroamericanos, con casi un 12,5 % ms de mujeres que se graduaron. La siguiente brecha ms grande fue entre los estudiantes nativos de Alaska, con casi un 11 % ms de mujeres nativas de Alaska que se graduaron que hombres. Los hombres nativos de Alaska tenan la tasa de graduacin ms baja (47,7 %) de todos los grupos tnicos o de gnero (Brian Laurent, comunicacin personal, 3 de noviembre de 2013).",5
"Existen argumentos slidos para fortalecer la infraestructura de informacin de calidad en torno a los hospitales y desarrollar nuevas orientaciones polticas para impulsar la mejora en el resultado de la atencin hospitalaria. Planificar la especializacin y diferenciacin ms clara de la funcin de las camas hospitalarias es un paso fundamental para asegurar un uso adecuado de los recursos hospitalarios y mejorar tanto los resultados como la eficiencia asistencial. Con base en algunos indicadores de la OCDE relacionados con la estimacin de supervivencia de cinco aos para el cncer, Japn parece tener un buen desempeo.",3
"No se han identificado casos desde entonces, pero la fuente del brote sigue siendo incierta. En 2000, se informaron 291 casos de hepatitis viral A transmitida por el agua en Uvurkhangai Aimag. En comparacin con 2015, se observ una disminucin de los casos de sfilis congnita en 2016. De hecho, se registraron 42 casos de sfilis congnita en 2016 (52 casos en 2015), 25 de los cuales se registraron en Ulaanbaatar. Esta disminucin en los casos de sfilis congnita se atribuy a un mejor control del embarazo.",5
"Las correlaciones entre innovacin y equidad de oportunidades de aprendizaje son dbiles (Figura 18.17). En particular, en toda la distribucin de puntajes de innovacin hay muchos sistemas educativos con poca equidad en trminos de oportunidades de aprendizaje. Esto contrasta notablemente con la medida de igualdad de rendimiento de lectura descrita anteriormente. Sin embargo, los tres sistemas educativos ms equitativos en este sentido, Hong Kong, Corea y Singapur, tambin estn por encima del promedio en trminos de innovacin general.",4
"Las escuelas tambin estn interesadas en mejorar su reputacin enviando a la mayor cantidad posible de sus graduados a instituciones prestigiosas. Esto conduce a una mirada de tcnicas para mejorar el rendimiento y mantiene a flote una industria de innovadores, productores y proveedores de dispositivos de trampa. Los cursos de tutora y preparacin para exmenes tienen un costo adicional y son proporcionados por un prspero sector privado.",4
