Textos_espanol,sdg
"En 2014, una media del 77 % de los nios de 3 aos estaban matriculados en programas de desarrollo educativo para la primera infancia o en educacin preescolar en los pases de la UE22 (en comparacin con la media de la OCDE del 71 %). Entre 2005 y 2014, la matrcula de nios de 3 aos en educacin preescolar aument del 69 % al 76 %, y la matrcula de nios de 4 aos aument del 84 % al 89 %, en promedio entre los pases con datos para ambos aos . En Blgica, Dinamarca, Francia, Alemania, Italia, Luxemburgo, los Pases Bajos, Espaa y el Reino Unido, al menos el 95 % de los nios de 4 aos estn matriculados en educacin infantil.",4
"En Brasil, el gobierno federal establece las normas generales para las escuelas pero no tiene responsabilidades directas, con algunas excepciones, sobre las escuelas primarias y secundarias, que son principalmente locales (municipios) y regionales (estados). Ambos niveles tienen un alto grado de autonoma en la determinacin de su plan de estudios. El grupo tambin tuvo como objetivo brindar la asesora tcnica necesaria para dar forma al programa de acuerdo con la metodologa educativa oficial, as como facilitar la inclusin de conceptos financieros en el currculo normal de las escuelas primarias y secundarias.",4
"Epidemias como el sarampin y la poliomielitis y la limitada respuesta del sistema de salud estn empeorando la situacin. Los indicadores de salud incluso mejoraron durante la dcada de 1980, la mortalidad infantil disminuy de 80 por 1.000 nacidos vivos en 1979 a 40 en 1989, y la tasa de mortalidad de menores de 5 aos se redujo de 120 a 60 por 1.000 nacidos vivos.21 Sanciones internacionales impuestas durante la dcada de 1980 y Sin embargo, el consiguiente retroceso del desarrollo econmico afect el sistema de salud y los resultados sanitarios. La esperanza de vida al nacer y la esperanza de vida ajustada por salud no mejoraron entre los jvenes entre 1990 y 2010.",3
"Para la salud, el NDOH presenta sus planes de negocios (incluidas las nuevas ofertas) al Tesoro Nacional, y los nueve departamentos de salud provinciales presentan planes de negocios a sus correspondientes tesoreras provinciales. Luego tienen lugar las negociaciones iniciales. Para la salud, se llevan a cabo reuniones bilaterales entre la Tesorera Nacional y altos funcionarios de salud, con reuniones equivalentes entre la tesorera provincial y los departamentos de salud provinciales, para discutir si los programas estn adecuadamente financiados.",3
"El sector privado generalmente apoya la prestacin de servicios y la recaudacin de fondos. En algunos pases, el sector privado se encuentra en las primeras etapas de desarrollo, mientras que en otros se ha expandido considerablemente (Cercone, 2005). Revertir esta tendencia e implementar los mecanismos necesarios para contener los crecientes costos del sistema son los principales desafos que enfrentan los pases del Caribe en trminos de equidad y acceso a los servicios de salud.",3
"En gran parte del Norte Circumpolar, los pueblos indgenas tenan experiencias comunes dentro de los sistemas educativos basados en formas ""occidentales"" de enseanza, aprendizaje y conocimiento y operando con la intencin de asimilacin. Ahora, en todo el norte y en otros lugares, como Nueva Zelanda y Hawi, los pueblos indgenas estn trabajando para crear sistemas educativos controlados por los indgenas basados no en la forma occidental de escolarizacin que se les impuso durante el ltimo siglo (o ms) sino ms bien basados en la educacin indgena. epistemologas y cosmovisiones. En algunas regiones circumpolares, estos esfuerzos estn ocurriendo junto con el sistema educativo occidental dominante, mientras que en otras, los sistemas occidentales estn siendo reemplazados por completo.",4
"Tal visin puede establecer nuevas expectativas para las actitudes y el comportamiento de hombres y mujeres. Un plan estratgico puede estructurar los planes nacionales de igualdad de gnero y guiar la puesta en marcha de las reformas institucionales necesarias para cumplir los objetivos nacionales y alinearse con los estndares internacionales de igualdad de gnero. Juntos, una visin inspiradora y un plan estratgico cuidadosamente elaborado pueden trazar un curso de reforma y facilitar un enfoque de comunicacin efectivo que involucre a una amplia gama de partes interesadas (por ejemplo, organizaciones de mujeres, tomadores de decisiones clave en todos los niveles de gobierno, organizaciones sin fines de lucro). actores, as como ciudadanos y ciudadanas) como socios para poner fin a la desigualdad de gnero.",5
"En los Estados Unidos, la gran oferta de cannabis se debe a la extensa produccin ilegal dentro del pas, el contrabando a gran escala desde Mxico y la produccin a gran escala y el desvo de los estados dentro de los Estados Unidos que permiten la produccin de cannabis con fines no mdicos y con fines medicinales. programas Las autoridades de algunos estados se han quejado de un efecto indirecto creado en su territorio por el desvo con fines de trfico de cannabis de los estados vecinos que han legalizado la droga para fines no mdicos. Las autoridades de los Estados Unidos tambin han informado de un aumento del 62% en el nmero de visitas a los servicios de urgencias relacionadas con el cannabis entre 2004 y 2011.",3
"Por ejemplo, en Nepal, el PNUD apoy un caucus de mujeres de todos los partidos que construy con xito poder y una agenda comn en torno a los derechos de las mujeres en la Asamblea Constituyente de 2008 a 2013.118 Sin embargo, su xito no fue duradero, y la segunda La Asamblea Constituyente, elegida en 2013, aboli el caucus. A los ojos de las mujeres involucradas en el caucus, esto se debi a que haban construido una base de poder slida, solidaridad y una voz fuerte a travs de las lneas partidistas que amenazaban el liderazgo y el statu quo. Bajo la Unin Sovitica, la participacin de las mujeres en los mercados laborales y la poltica era igual a la participacin de los hombres.",5
"Para uno de estos encuestados, el problema era principalmente uno de desarrollo econmico desigual entre los centros urbanos y rurales. Pero vale la pena sealar que los encuestados chinos tambin vieron los beneficios de la colaboracin en torno al control de enfermedades infecciosas en ambas direcciones, no solo hacia China, sino hacia el resto del mundo. Por lo tanto, dos encuestados sealaron que el control de enfermedades infecciosas no es simplemente una preocupacin nacional, sino que tiene implicaciones internacionales y globales, y que, en consecuencia, como lo expres uno de los encuestados, ""es necesario un enfoque global integrado para comprender la transmisin y evolucin de los agentes de enfermedades infecciosas"". . Por lo tanto, la cooperacin y el intercambio internacionales beneficiaran no solo a China, sino que contribuiran al trabajo de control de enfermedades infecciosas en un contexto internacional. En el caso de Sudfrica, este patrn se invirti. Las respuestas sudafricanas a las secciones del cuestionario que preguntaban sobre medicina estratificada fueron muy breves en comparacin con las relacionadas con el control de enfermedades infecciosas.",3
"Sin embargo, a nivel mundial, los datos sobre el uso del tiempo siguen siendo limitados, en particular para los pases en desarrollo, debido a los importantes costos y capacidades necesarios para realizar una encuesta sobre el uso del tiempo. La presentacin de informes sobre la Meta 5.4 de los ODS requiere datos recopilados regularmente sobre el uso del tiempo, desglosados por sexo, grupo de edad y ubicacin. Sin embargo, hasta la fecha, solo 83 pases han realizado alguna vez encuestas sobre el uso del tiempo, y solo el 24 % de ellas se realizaron despus de 2010 (ONU Mujeres, 2018). De los 47 pases menos adelantados, solo 8 han recopilado datos sobre el uso del tiempo.",5
"La participacin de los profesionales, a travs de programas que son fciles de usar, flexibles en el tiempo, interactivos y que responden a las necesidades de los profesionales, maximizar el impacto de los programas de CPD. En varios pases de la OCDE, existen incentivos para CPD. En Austria, la formacin bsica en salud mental para los mdicos de atencin primaria es bastante limitada, pero algunos mdicos de atencin primaria han recibido formacin adicional en medicina psicoteraputica en diferentes intensidades. La formacin tiene como resultado la acreditacin de los diplomas psy-1, psy-2 y psy-3 que tambin permiten a los mdicos de atencin primaria administrar determinados tratamientos (en total, unos 5 000 mdicos generales en Austria tienen uno de estos diplomas).",3
"En Hungra, la Ley de Educacin Pblica de 2011 legisla expresamente el enfoque de escuela integral, encargando a los ministros responsables de la educacin y el medio ambiente que desarrollen los programas Green Kindergarten y Eco-School en todo el pas. Sobre la base de esta promocin, parecera que el nmero de jardines de infancia verdes ha aumentado a 633 (el 17,6 % de todos los jardines de infancia), y aproximadamente 700 escuelas ahora forman parte del programa Eco-Schools (el 14,6 % de todas las escuelas) (Hungra , informe informal de 2014). Finlandia ha incluido planes de EDS en sus estrategias generales de EDS y proporciona a las escuelas modelos, ejemplos y apoyo prctico para elaborar planes de DS. Sus hallazgos son consistentes con los comentarios proporcionados por los Estados miembros a travs de sus NIR e informes nacionales informales.",5
"En la comunidad flamenca, hay indicios de que existe una distribucin desigual de los docentes en las escuelas, y los docentes ms experimentados suelen emplearse en las escuelas menos desafiantes. Segn los datos de TALIS 2013, mientras que el 16 % de los docentes de secundaria inferior trabajaban en escuelas con ms del 30 % de estudiantes provenientes de entornos familiares desfavorecidos, este era el caso del 26,6 % de los docentes principiantes (es decir, docentes con 5 aos de experiencia docente o menos). . En los pases y economas que se encuentran en la parte superior de esta figura (con diferencias positivas), es ms probable que los docentes experimentados trabajen en escuelas con una alta proporcin de estudiantes de entornos socioeconmicamente desfavorecidos. La Figura 4.6 muestra que para la mayora de los pases, sin embargo, ocurre lo contrario.",4
"Su nivel educativo sera inferior a 3 aos en comparacin con el nivel educativo promedio de su esposo de poco menos de 4. Dado que el punto de referencia para la alfabetizacin funcional se establece en un rango entre 3 y 5 aos de educacin (UNESCO ha adoptado el punto de referencia de 5 aos en sus encuestas sobre este tema), esto significa que la mujer promedio en este momento tendra una alfabetizacin limitada (Gray, 1969). Cincuenta aos despus, la mujer equivalente tendra ms del doble del nivel educativo de su hermana de la dcada de 1950, habiendo pasado un promedio de casi 6,5 aos en la escuela.",5
"En las reas rurales, 11 grupos de distrito involucran a personas discapacitadas, padres, maestros y nios que se identifican como personas discapacitadas, aseguran suficientes materiales de enseanza y aprendizaje y maestros auxiliares, hacen que el ambiente de aprendizaje sea acogedor, organizan eventos para crear conciencia y recolectan fondos para educacin fsica. mejoras de acceso. El trabajo con las familias fue fundamental para alentarlas a escolarizar a sus hijos discapacitados y convertirse en aliadas en su lucha por los derechos y la educacin. Los estudios de casos se utilizan en la promocin nacional e internacional de cambios en las leyes, polticas y programas de desarrollo relevantes para la educacin inclusiva.",5
"En las sociedades multiculturales, los gobiernos pueden querer crear una fuerza laboral capacitada y bien informada y priorizar los valores compartidos para construir un sentido de comunidad. Mientras tanto, algunas personas pueden estar preocupadas por transmitir idiomas y costumbres especficas a los nios respetando creencias especficas sobre la crianza de los nios. En el contexto de Nueva Zelanda, algunas de estas consideraciones reciben un peso y una forma ms especficos por la relacin entre la Corona y los maores definida por el Tratado de Waitangi, y el estatus nico de los maores como tangata whenua (indgena). Los planes de estudio pueden contribuir a equilibrar las diferentes expectativas del desarrollo de la primera infancia en el plan de estudios y garantizar que se cumplan las expectativas y necesidades de las diferentes partes interesadas (Bennett, 2011, Siraj-Blatchford y Woodhead, 2009, Vandenbroeck, 2011). Un currculo enfocado con metas claras ayuda a asegurar que el personal de ECE cubra reas crticas de aprendizaje o desarrollo.",5
"Sin embargo, incluso las decisiones polticas aparentemente neutras en cuanto al gnero pueden tener efectos, ya sea intencionales o no, en las posibilidades de las mujeres de convertirse en participantes equitativas en la sociedad. Pueden hacer que les resulte ms difcil encontrar empleo, asegurar una educacin, iniciar un negocio, satisfacer las necesidades de su familia o garantizar sus derechos humanos. La UE define GIA como un proceso para comparar y evaluar, de acuerdo con criterios relevantes de gnero, la situacin actual y la tendencia con el desarrollo esperado resultante de la introduccin de la poltica propuesta (Comisin Europea, n.d.).",5
"La tabla tiene, en contraste con esta heterogeneidad real especfica de cada pas, principalmente un valor didctico. El sector privado de atencin de salud mental (psiclogos o psiquiatras en prctica privada, segn el pas) tambin est abierto a personas con trastornos ms leves y condiciones por debajo del umbral. Sin embargo, la mayora de los enfermos mentales necesitados, que tienen al menos un trastorno mental leve y, a menudo, estn parcialmente aislados de la vida social y laboral, no encuentran la ayuda adecuada. El consultorio de atencin primaria es el lugar donde se presenta la mayora de las personas con problemas de salud mental, especialmente por primera vez.",3
"En los pases de la OCDE, un estudiante con ms ventajas socioeconmicas obtiene 39 puntos ms en matemticas, el equivalente a casi un ao de escolaridad, que un estudiante con menos ventajas. En Portugal, la diferencia de rendimiento en matemticas es de 35 puntos. Junto con Chile, Hungra, Luxemburgo y la Repblica Eslovaca, la relacin en Portugal entre desempeo y estatus socioeconmico est significativamente por encima del promedio de la OCDE (OCDE, 2014a). La posicin de Portugal contrasta con la de Italia, que, por ejemplo, mostr un nivel de desempeo y una mejora en los resultados de PISA similares a los de Portugal entre 2003 y 2012 (ver Figura 9).",4
"Los flujos de ayuda restantes que no se compararon con el marcador se atribuyeron principalmente a los informes de los Estados Unidos. Los otros 23 miembros del DAC combinaron un total del 92% de su ayuda. Canad se destaca como la excepcin en este sentido, con el 42,4% de su ayuda dirigida a la igualdad de gnero como objetivo principal.",5
"Como resultado, los resultados de salud siguen siendo inferiores a los de la OCDE y las desigualdades son significativas. En general, las reformas han ido en la direccin correcta. Por lo tanto, las razones del progreso limitado son profundas y difciles de captar, especialmente en un entorno donde los sistemas de informacin no estn orientados hacia ese objetivo. En parte, el lento progreso puede atribuirse a la magnitud de la tarea en cuestin. De hecho, no se presta suficiente atencin a la medicin del progreso real hacia la implementacin efectiva.",5
"Sin embargo, basadas en actitudes de culpar a la vctima, en las que se prestaba una atencin y un enfoque considerables a mejorar el comportamiento del ser humano, las polticas de seguridad vial carecan del enfoque holstico necesario para lograr una reduccin significativa de las lesiones. Un Sistema Seguro no ve las muertes y lesiones en las carreteras como el precio inevitable a pagar por una sociedad altamente motorizada. Al ver cualquier muerte en la carretera como una falla inaceptable del sistema, se contrarresta el riesgo de que los planificadores del transporte puedan adoptar medidas de eficiencia del transporte que toleren muertes que se pueden prevenir de manera asequible.",3
"La densidad de camas tambin es marcadamente baja, con 1,6 camas por 1 000 habitantes en 2013, en comparacin con 4,8 camas por 1 000 en toda la OCDE: nuevamente, la ms baja entre los pases de la OCDE. Aunque el gasto total per cpita ahora es bastante similar para las personas con y sin seguridad social (a MXN 3 429 per cpita para las personas sin seguridad social en 2013, en comparacin con 3 505 para el IMSS y 3 945 para los afiliados al ISSSTE), las diferencias en los derechos persisten, involucrando algunas enfermedades comunes y devastadoras. Los infartos de miocardio en mayores de 60 aos, los accidentes cerebrovasculares, la dilisis tras insuficiencia renal, la esclerosis mltiple y el cncer de pulmn, por ejemplo, no estn cubiertos por el SP. Algunas diferencias en el acceso tambin son evidentes.",3
"En otras escuelas, los maestros establecen objetivos educativos para sus alumnos y evalan su desempeo en gran medida por s mismos. En la red SIP, las organizaciones asociadas brindan desarrollo profesional, as como clases de recuperacin y apoyo psicosocial para nios. La Sociedad de Instruccin Primaria (cont.) La enseanza est estructurada por los objetivos formulados por el departamento pedaggico y los incentivos econmicos para los maestros a veces estn ligados a su logro.",4
"Si bien las mujeres viven ms que los hombres, tambin se enferman con ms frecuencia. A las nias ahora les va mejor que a los nios en la escuela, pero siguen estando insuficientemente representadas en los campos clave de la educacin que brindan mayores oportunidades laborales. Del mismo modo, aunque las mujeres estn cada vez ms presentes en el mercado laboral, todava ganan menos que los hombres, dedican ms horas al trabajo no remunerado y les resulta ms difcil llegar a la cima de la carrera profesional o iniciar su propio negocio. Los hombres son con mayor frecuencia las vctimas de homicidios y agresiones, pero las mujeres son el objetivo principal de la violencia de pareja.",5
"En particular, la cada significativa en el nmero de estudiantes matriculados en programas vocacionales cortos provoca escasez de ciertas ocupaciones. Este nmero se redujo en ms del 50 % (de alrededor de 2 000 estudiantes a alrededor de 1 000) entre 2007 y 2009. Los programas de formacin profesional media tambin experimentaron grandes descensos en la matrcula de ms de 18 000 estudiantes en 2007 a alrededor de 12 000 estudiantes en 2009.",4
"En particular, los objetivos establecidos por la ley son: i) evaluar el aprendizaje de los estudiantes, ii) trabajar en las innovaciones pedaggicas necesarias para mejorar el aprendizaje de los estudiantes, iii) intercambiar experiencias pedaggicas, iv) disear estrategias de enseanza para los estudiantes, v) establecer criterios para planes de mejora. , y vi) recibir asistencia tcnica de las asesoras tcnico-pedaggicas del Ministerio de Educacin (Asesores Tecnico-Pedagogicos, ATP) o de asesoras independientes (Asesores Tecnico-Pedaggicos, ATE). El canal, sin embargo, ha llegado a muy pocas escuelas (en total 1000 escuelas en Latinoamrica) (https://escue!ap!us.com/). Este programa se introdujo en 2000 como una estrategia para expandir el programa Conexiones (Enlaces) a las reas rurales e incluy la provisin de computadoras a las aulas multigrado, as como la capacitacin de maestros.",4
"Desde la dcada de 1980, los pases nrdicos han implementado una variedad de diferentes tipos de medidas destinadas a mejorar el equilibrio de gnero en el mundo acadmico. Se han implementado medidas de igualdad de gnero dentro de los sectores de educacin e investigacin, en los consejos nacionales de investigacin y en universidades, colegios universitarios e institutos de investigacin independientes. Estas medidas se han centrado en mejorar el equilibrio de gnero en reas temticas especficas, categoras de puestos e instituciones o en la academia y el sector de la investigacin en general. Primero, las estadsticas sobre educacin e investigacin en la regin nrdica se han desglosado por gnero desde la dcada de 1980, e incluso antes en algunos pases, lo que ha sido crucial para desarrollar datos adecuados sobre las medidas de igualdad de gnero en el mundo acadmico.",5
"En programas exitosos, los maestros mentores brindan orientacin y supervisin a los maestros principiantes en estrecha colaboracin con la institucin de formacin inicial de maestros. Estos mentores brindan apoyo en el trabajo, identifican deficiencias en el conocimiento de la materia, estrategias de gestin del aula y otros procesos pedaggicos. A menudo, las escuelas que necesitaran brindar el mayor apoyo a los maestros principiantes son las menos capaces de ofrecer programas de induccin de alta calidad.",4
"En promedio en los pases de la OCDE, y despus de tener en cuenta el perfil socioeconmico de las escuelas, no se puede identificar una asociacin entre el porcentaje de estudiantes inmigrantes que asisten a una escuela y la probabilidad de que los estudiantes que asisten a esa escuela alcancen los niveles bsicos de competencia acadmica. Despus de tener en cuenta el perfil socioeconmico de las escuelas, una alta concentracin de estudiantes inmigrantes se asoci con un desempeo ms bajo en Alemania, Eslovenia, Espaa y Suiza. Eslovenia fue el nico pas donde los estudiantes que asisten a escuelas en las que ms de uno de cada cuatro estudiantes tiene un origen inmigrante tienen menos probabilidades de alcanzar los niveles bsicos de competencia, despus de tener en cuenta el perfil socioeconmico de la escuela.",4
"Esto tambin implica dar suficientes recursos a los casos difciles y conservar los recursos en los casos en que su uso sera subptimo. Adems, los cambios en los sistemas de pago podran tener consecuencias a largo plazo para el uso de la tecnologa, las prcticas mdicas y los costos a lo largo del tiempo (McClellan, 2011). Sin embargo, no han sido efectivos para evitar derivaciones innecesarias y ofrecer atencin definitiva. Entre 1990 y 2008, el nmero de derivaciones no diagnsticas a atencin especializada ambulatoria aument ms de cuatro veces, mientras que el nmero de pacientes derivados a atencin hospitalaria por mdico aument casi un 80% (Gaal et al.,",3
"En promedio, una diferencia de casi 40 puntos en el dominio de la alfabetizacin separa a los adultos de padres con un alto nivel educativo de aquellos cuyos padres tienen los niveles ms bajos de educacin. En promedio, la probabilidad de tener un desempeo bajo es alrededor de 25 puntos porcentuales menor para los adultos con al menos un padre con educacin terciaria, en comparacin con los adultos cuyos padres tienen educacin secundaria superior. Los adultos cuya alfabetizacin est clasificada en el Nivel 1 e inferior predominantemente tienen padres con poca educacin. En promedio, ms de la mitad de los adultos (52,2 %) por debajo de la lnea de base en el dominio de la lectura tenan padres que no haban completado la educacin secundaria superior.",4
"Tal progreso ha permitido que Colombia se convierta en un lder regional en actividades clave. Su agencia de evaluacin de tecnologas de la salud, el Instituto de Evaluacin Tecnolgica en Salud, es una de las ms avanzadas de Amrica Latina, por ejemplo. El conflicto ha provocado desplazamiento y toma forzosa de tierras, reclutamiento forzado y secuestro, homicidios, lesiones y violencia sexual. En total, se estima que 7,1 millones han sido vctimas del conflicto armado entre 1985 y 2015, en su mayora colombianos pobres y rurales.",5
"Reducen la produccin econmica mundial y nacional, ejercen presin sobre los gobiernos y los sistemas de salud nacionales, sobrecargan a los hogares vulnerables, ponen en riesgo los derechos humanos y socavan gravemente el progreso del desarrollo (PNUD 2013b, Banco Mundial 2014). La prdida de productividad debido a enfermedad, discapacidad o muerte por ENT puede impedir el crecimiento macroeconmico y desviar los presupuestos pblicos de otros objetivos importantes de salud y desarrollo (OMS 2010, Bloom et al. En contraste, las muertes por enfermedades transmisibles durante el mismo perodo se redujeron en un 27 por ciento de alrededor de 16,1 millones de personas en 1990 a 11,8 millones en 2013, mientras que las muertes por diversas formas de lesiones aumentaron en un 10 por ciento de alrededor de 4,3 millones de personas en 1990 a 4,8 millones en 2013 (GBD 2013).",3
"En segundo lugar, la enseanza para el examen enfatiza la memorizacin y un enfoque ms pasivo del aprendizaje, ya que los maestros pasan ms tiempo desarrollando estrategias para tomar exmenes en lugar de cultivar las habilidades de resolucin de problemas de los estudiantes (Kellaghan et al., Al involucrar a los maestros en el desarrollo e implementacin de pruebas estandarizadas y capacitar a los maestros sobre cmo usar y analizar de manera efectiva los resultados de las pruebas, puede haber menos riesgo de ensear para la prueba. Sin embargo, los incentivos adjuntos a los resultados de las pruebas deben construirse cuidadosamente para evitar motivar comportamientos estratgicos como ensear para la prueba, la investigacin es mezclados en cuanto a cmo promover de manera efectiva comportamientos positivos como resultado de incentivos mientras se reducen los comportamientos negativos.",4
