Textos_espanol,sdg
" Han examinado la contribución de las universidades y las instituciones de educación terciaria al desarrollo del capital humano y las competencias, la transferencia de tecnologa y la innovación empresarial, el desarrollo social, cultural y medioambiental, y la creación de capacidad regional. El proceso de revisión ha facilitado la creación de asociaciones en ciudades y regiones al reunir a instituciones de educación terciaria y organismos públicos y privados para identificar objetivos estratégicos y trabajar juntos para alcanzarlos. Complementa las revisiones que se han llevado a cabo en la regin transfronteriza Mxico-Estados Unidos, de gran importancia estratgica y econmica, como las de Nuevo Len, la regin Paso del Norte y, ms recientemente, la del sur de Arizona (2011), junto al estado de Sonora. ",5
"En la ltima dcada, y en particular desde 2010, el nmero de altas per cpita ha tendido a disminuir, y ahora est en lnea con la media de la OCDE mencionada anteriormente. Por ejemplo, los habitantes de zonas rurales representan el 43% de la poblacin, pero slo el 32% de las altas hospitalarias. A falta de informacin complementaria, no es posible determinar si esta diferencia indica o no disparidades en el acceso de las poblaciones rurales y, en caso afirmativo, si las causas son geogrficas, culturales o infraestructurales. No parece que se recojan datos sobre el acceso a la atencin desde el punto de vista del paciente, lo que ayudara a comprender la naturaleza de los obstculos al acceso (y las soluciones). En general, no es posible determinar con los datos disponibles si los ingresos o las caractersticas socioeconmicas de los pacientes influyen a la hora de llegar a las puertas del hospital o de ser ingresado. El acceso desigual probablemente se deba tambin a la incapacidad de los centros de las distintas regiones para prestar los mismos servicios. ",3
"En qu pases los estudiantes de alto rendimiento se sienten atrados por la docencia? Las encuestas de docentes en servicio a menudo muestran que los maestros actuales estn muy motivados por los beneficios intrnsecos de la enseanza: trabajar con nios y ayudarlos a desarrollarse y hacer una contribucin a la sociedad, mientras que los estudios que encuestan a grandes grupos de graduados sobre sus opciones de carrera muestran que la los salarios relativos de las ocupaciones de los graduados juegan un papel en sus elecciones: si los salarios de los docentes hubieran sido ms altos, ms ""docentes potenciales"" habran considerado seriamente una carrera en la enseanza. A nivel de pas, los resultados indican que tanto los salarios de los docentes como la estatus social de la profesin docente se asocian positivamente con las expectativas de los estudiantes de trabajar como docentes.",4
"A raz de su preocupacin por el hecho de que los mdicos de todo el sistema sanitario japons no fueran capaces de identificar los signos de sufrimiento psicolgico que podran ayudar a reducir los suicidios, la Asociacin Mdica Japonesa informa de que empez a compartir informacin y orientaciones sobre la depresin con todos los mdicos, primero en 2004 y luego de nuevo en 2009. En la actualidad, slo se recogen indicadores sobre la tasa de reclusin y contencin, y de ingresos involuntarios, por parte de los proveedores y a nivel prefectural. La informacin recopilada sistemticamente sobre el sistema de atencin de salud mental se limita a indicadores estructurales: instalaciones, nmero de personal, nmero de camas. ",3
"1999|H5|, Ares Abalde, 2014[ij]. El pequeo nmero de estudiantes y docentes en estas escuelas da forma a las formas en que las escuelas pueden utilizar el tiempo de docentes y alumnos, y cmo estos se agrupan por grados y habilidades (Mulcahy, 2009[ii6i). Los padres pueden estar preocupados por el hecho de que sus hijos aprendan junto con nios de diferentes edades en el mismo saln de clases (Cornish, 2006[ii7j), pero la investigacin sugiere que la enseanza multigrado no es necesariamente menos efectiva que en clases de edades especficas.",4
"A continuacin, se propone una sntesis de pas con el fin de resaltar la coherencia de la poltica nacional en la materia. Dicha coherencia se construye sobre la fuerza de las asociaciones que existen entre los Niveles 2, 3 y 4. La siguiente tabla resume el contenido de las recomendaciones y especifica si existe un diploma relacionado con el campo de los usos de las TIC en la educacin. El caso de cada pas se describe especficamente en los siguientes prrafos.",5
"A diferencia de los acuerdos anteriores, la nueva normativa no estipula la cantidad de tiempo que debe utilizarse para distintos fines, como la enseñanza y la preparación. Las decisiones sobre el uso del tiempo de los profesores y el lugar de trabajo recaen ahora en la dirección del centro y se espera que los profesores trabajen de forma diferente. En 35 sistemas, el tiempo de enseñanza se especifica contractualmente.",5
"Por ejemplo, los servicios de urgencias tienen que prestar asistencia aunque ya se hayan cubierto las cuotas anuales de determinados servicios, por lo que el nmero de casos de este tipo puede proporcionar alguna indicacin de si las cuotas se han fijado adecuadamente. El origen y destino final de los pacientes tambin puede proporcionar una indicacin de si la capacidad en los distintos niveles de atencin es adecuada, tanto en trminos de acceso como de calidad de la atencin. En 2013, haba 3,1 mdicos en ejercicio por cada 1 000 habitantes, cerca de la media de la OCDE de 3,2, y un ligero aumento con respecto a 2000, cuando haba 2,9 mdicos en ejercicio por cada 1 000 habitantes en Letonia. ",3
"A lo largo de diez aos cerraron escuelas especiales y destinaron los recursos al sistema general. No obstante, reconoce que no siempre se trata a las personas como iguales y que los jvenes con discapacidad sufren discriminacin y desventajas. El Consejo cree que la educacin especial segregada es un factor importante de discriminacin. ",5
"A medida que se implemente la nueva estructura de carrera, ser crucial que el proceso de certificacin establecido enve seales claras de rigor para identificar tanto el buen desempeo en las diferentes etapas de la carrera como el bajo desempeo como docente. Un tema importante ser resolver la duplicidad actual entre el proceso de certificacin asociado a la estructura de carrera y el sistema de evaluacin del desempeo docente. Para aprovechar el carcter continuo del sistema de evaluacin del desempeo docente y atender la necesidad de que los docentes demuestren continuamente su idoneidad para la profesin en los diferentes niveles de la estructura de la carrera, podra considerarse la introduccin del requisito de recertificacin en determinada etapa de la carrera.",4
"Adems, el seguimiento y planificacin de la red escolar es limitado. Hay bastantes escuelas muy pequeas con clases pequeas que no ofrecen una rica experiencia de aprendizaje a los estudiantes. Esta situacin surge porque no se ha realizado una revisin de la red escolar para evaluar la necesidad de alguna reorganizacin de la oferta educativa local y no se han desarrollado estrategias importantes de transporte escolar.",4
"Cada vez se reconocen ms las repercusiones de un medio ambiente degradado sobre la salud y su reduccin se considera uno de los principales objetivos de la poltica, los programas y la normativa de proteccin medioambiental. Se ha avanzado en el control de la calidad de los principales medios ambientales y en la vigilancia de las enfermedades infecciosas. Se ha reforzado la capacidad profesional en materia de salud pblica y medioambiental con mtodos avanzados de vigilancia sanitaria y evaluacin de riesgos. ",3
"Formulario nico de recogida de datos - Datos agregados). Una estancia de ms de 24 horas se considera una lesin grave, y menos, una lesin leve. Sin embargo, desde 2010, la ANSV est trabajando con el Ministerio de Salud de la Nacin para vincular los registros hospitalarios y los datos del Formulario Naranja. Este proyecto de vinculacin se inici como piloto en dos de las provincias ms pobladas de Argentina, con el fin de recopilar datos basados en el MAIS 3. ",5
"El principal instrumento de medicin, el Adult Mental Health Benchmarking Toolkit, presenta indicadores de resultados en formato de cuadro de mando, combinando indicadores estructurales, de proceso y de resultados. Por lo general, se entiende que los trastornos leves a moderados (como la depresin y la ansiedad) no requieren tratamientos altamente especializados administrados por psiquiatras o en rgimen de hospitalizacin en la gran mayora de los casos. Por el contrario, requieren una slida atencin primaria y comunitaria. Aunque la atencin primaria es, en la inmensa mayora de los casos, el primer punto al que acuden las personas que sufren trastornos mentales, los mdicos de atencin primaria no siempre disponen de las competencias y opciones de tratamiento adecuadas para responder eficazmente a las necesidades. ",3
"Los esfuerzos deben centrarse en abordar las desigualdades en el acceso a los servicios sanitarios -entre regiones, as como entre ciudades y zonas rurales- teniendo en cuenta la geografa del pas y la baja densidad de población en la planificación de la prestación sanitaria. Las redes de instalaciones a todos los niveles deberan reorganizarse de forma compatible con los nuevos modelos de prestación de servicios y en apoyo de los mismos, y ajustarse a las tendencias demográficas y los patrones de acceso. Para este ejercicio, un punto de partida podran ser los planes maestros de prestación de servicios desarrollados en los últimos años. ",5
"Incluso en los pases de la OCDE considerados con una atencin primaria fuerte, como el Reino Unido, Australia y Nueva Zelanda, una gran proporcin de mdicos sigue trabajando en solitario. En Israel, un consultorio medio de atencin primaria cuenta con el equivalente a 3,4 mdicos generalistas, 2,6 enfermeras, 1,5 auxiliares y la mayora tiene un director de consulta. En los ltimos aos, el Reino Unido, Australia, Francia y Suiza han modificado la financiacin o proporcionado pagos adicionales a los mdicos de cabecera para intentar dar prioridad a estos servicios, pero han tenido un xito limitado a la hora de impulsar un cambio en todo el sistema. ",3
"Adems, los alumnos de los cursos 9 y 10 tienen una tarea de proyecto obligatoria que les da la oportunidad de completar y presentar un proyecto interdisciplinar. El proyecto se evala mediante una declaracin escrita basada en el contenido, el proceso de trabajo y la presentacin del trabajo final. La evaluacin del proyecto se puede indicar en el certificado de fin de estudios. ",4
"Al abordar este desafo poltico, los REA pueden actuar contra los silos de conocimiento (Plotkin, 2010:5), independientemente de si estos se derivan de las diferencias entre las instituciones educativas, los pases o los entornos de aprendizaje formales, informales y no formales. En cada caso, el intercambio de recursos hecho posible por REA es ms valioso cuando los recursos se liberan como REA completos que permiten no solo reutilizar sino tambin remezclar y reutilizar.",5
"Sin embargo, la prevalencia de nios de 0 a 6 meses con bajo peso aument del 6,9% en 2005 al 8,4% en 2010. En 2014, el bajo peso al nacer era ms frecuente en las zonas rurales (sobre todo en la regin occidental, con un 6,6%) que en las urbanas (3,8% en Uln Bator). En 1997, el Gobierno aprob una primera lista de productos qumicos txicos y peligrosos prohibidos y de uso limitado. ",3
"Al final de la educacin primaria, las escuelas deben informar sobre la medida en que sus alumnos han alcanzado los objetivos de aprendizaje bsicos esperados. Si bien las escuelas tienen la libertad de utilizar diferentes instrumentos para este propsito, el 85% de las escuelas utilizan la prueba de fin de primaria de Cito, que brinda informacin sobre el tipo de escuela ms adecuado para cada estudiante en la siguiente etapa de la educacin. Las nuevas leyes que se implementarn a partir del ao escolar 2014/15 obligan a las escuelas primarias a administrar sistemas regulares de monitoreo de estudiantes, as como una prueba final al final del ao 8.",4
"Con el teln de fondo de una prolongada falta de fuentes oficiales de informacin fiable sobre la produccin, el trfico y el uso indebido de drogas ilcitas entre los pases de la regin, ha habido varios informes de los medios de comunicacin y anecdticos sobre el uso indebido generalizado de comprimidos falsificados de Captagon (que contienen anfetamina) entre todas las partes implicadas en la violencia armada en la Repblica rabe Siria. Es significativo que, por primera vez en seis aos, el Estudio sobre el Opio en Afganistn 2015, del que se dispone del resumen ejecutivo, seala que se ha producido una disminucin de la superficie total estimada de cultivo ilcito de adormidera en Afganistn, que en 2015 ascendi a 183.000 hectreas (ha). Esto representa una disminucin en comparacin con 2014, cuando el cultivo alcanz niveles rcord, con 224.000 hectreas.",5
"Al mismo tiempo, la informacin oficial sobre las pruebas nacionales repite claramente el mensaje de que las pruebas nacionales solo miden un rea discreta del conocimiento y las habilidades de los estudiantes, brindando una instantnea del rendimiento de los estudiantes en objetivos de aprendizaje seleccionados, y que se necesitan evaluaciones complementarias para medir completamente proceso estudiantil. La investigacin de diferentes pases indica que, si bien la evaluacin tiene como objetivo principal medir el progreso y los resultados del aprendizaje, tambin tiene efectos en el proceso de aprendizaje en s (Somerset, 1996). Varios autores han descrito esta influencia de la evaluacin en la enseanza y el aprendizaje como el efecto de retroceso de la evaluacin de los estudiantes (Alderson y Wall, 1993, Baartman et al.,",4
"La falta de pruebas slidas de la medicin de la seguridad de los pacientes en los entornos de atencin primaria y ambulatoria puede explicarse en parte por la naturaleza fragmentada de este entorno descrita en la introduccin. De hecho, las respuestas a la encuesta sugieren que el carácter fragmentado de los ""sistemas"" de atención primaria y ambulatoria y la falta de gobernanza general del sistema son el principal obstáculo para la aplicación de medidas e intervenciones de seguridad (véase el captulo 4). Esto significa que la información rara vez puede vincularse. Estos obstáculos técnicos pueden impedir captar con precisión la imagen completa de la frecuencia y magnitud de los daños sufridos por los pacientes a lo largo de su recorrido.",3
"Los estudios que utilizan la clase ocupacional o el nivel educativo en lugar de la renta como indicador socioeconómico encuentran resultados cualitativamente similares, aunque las diferencias en la esperanza de vida son significativamente menores (Palosuo et al., El proyecto TEROKA pretende desarrollar una base de conocimientos y herramientas para promover la consecución del objetivo del programa de salud pública Salud 2015 de reducir las desigualdades en salud. An analysis of the recent hospital reform in Norway, en: Andresen y Gronlie (eds.), ",3
"Al no tratarse de planes de clase detallados, los recursos exigen (y presuponen) una gran autonoma y capacidad de accin por parte del profesorado. Estn dirigidos a profesores expertos que pueden disear su entorno de aprendizaje y sus clases. Sin embargo, como se ha comprobado sobre el terreno, los recursos pedaggicos no son suficientes para la mayora de los profesores y deben complementarse con otros recursos de aprendizaje. ",4
"Mientras que la eficacia mide el efecto de un agente teraputico en condiciones y entornos controlados, la efectividad mide el efecto de un tratamiento en condiciones menos controladas en entornos sanitarios del ""mundo real"". Medir la eficacia es mucho ms fcil en pacientes con una sola enfermedad. Por ello, es muy habitual que las personas con mltiples enfermedades crnicas queden excluidas de los ensayos clnicos aleatorizados.",3
"Algunos de los beneficios del reconocimiento de habilidades recaen en los empleadores solo colectivamente (por ejemplo, un sector econmico), ya que un sector tiene inters en tener un grupo de trabajadores calificados y calificados y el riesgo de caza furtiva asociado con habilidades ms visibles es menos problemtico para un sector que para un empleador individual. Incluyen tanto las habilidades relativamente simples involucradas en tareas fsicas o servicios digitales (ingreso de datos o soporte administrativo) hasta habilidades de nivel superior en actividades como programacin o consultora empresarial (OCDE 2016b). En estos contextos, muchas de las herramientas ""tradicionales"" de capacitacin y reconocimiento de habilidades no se aplicarn: no hay un empleador que recompense a un empleado que aprende rpido con salarios por hora ms altos o testifique que el trabajador ha adquirido un conjunto especfico de habilidades.",5
"An queda mucho por hacer para reducir los tiempos de espera en las consultas externas de los hospitales de otras zonas, y el Gobierno se ha comprometido a construir un nuevo bloque de consultas externas para aumentar la capacidad de atender la demanda. Tambin se est llevando a cabo un ejercicio para mejorar la eficiencia interna en la gestin de los servicios ambulatorios con vistas a reducir los tiempos de espera. Otros factores que ponen a prueba la capacidad del sistema sanitario son el aumento de la inmigracin de trabajadores y pensionistas, los turistas que utilizan el sistema sanitario y los cambios en los comportamientos de riesgo de la poblacin.",3
"Algunos ejemplos son el Informe nacional sobre el estado y el desarrollo de la educacin, los resultados del estudio de seguimiento de la evaluacin del desempeo de los estudiantes de quinto y noveno grado, el anlisis de los resultados de la evaluacin externa del rendimiento de los estudiantes de noveno grado y el anlisis de los resultados de la prueba nacional unificada de 2012. No existen esquemas formales para que los lderes escolares participen en el apoyo a sus pares en otras escuelas (por ejemplo, intercambiando mejores prcticas, asesorando a nuevos lderes, apoyando a aquellos en escuelas aisladas o de bajo rendimiento) y el concepto de lder del sistema que no solo puede liderar a su la escuela, sino que tambin contribuyen a la mejora de todo el sistema es bastante incipiente. Existen pocos mecanismos para compartir recursos entre las escuelas con el fin de hacer un uso ms eficiente de su infraestructura fsica, equipos y materiales didcticos, o de sus recursos humanos.",4
"Algunos municipios tambin han introducido polticas de rea de cdigo postal y aplicacin central para inscribir a los estudiantes en una determinada escuela sobre la base de las necesidades y caractersticas de la escuela en lugar de dar a las familias la posibilidad de elegir la escuela completa (Ministerie van Onderwijs, Cultuur en Wctcnschap, 2008(9oi En otras dos ciudades holandesas, Nijmegen y Deventer, el gobierno local impuso la integracin como criterio en el proceso de eleccin de escuela, con el objetivo de tener un 70% de estudiantes nativos junto con un 30% de estudiantes inmigrantes (Ladd, Fiske and Ruijs, 2009[ 7oj). Ms concretamente, todas las escuelas primarias de Nijmegen han acordado un sistema de suscripcin central basado en la distribucin de los alumnos en diferentes categoras para llegar a un porcentaje del 30 % de alumnos desfavorecidos en cada escuela.",4
"Algunos pases, incluidos Austria, Blgica, Canad, Chile, Italia, Japn, los Pases Bajos y Espaa, tambin brindan incentivos fiscales explcitos para la capacitacin, adems de la deducibilidad estndar de los costos de capacitacin y de los salarios pagados a los aprendices y aprendices. Las lecciones de evaluaciones recientes muestran que la efectividad de los incentivos fiscales depende de su diseo. Por ejemplo, un diseo muy complejo puede reducir las tasas de aceptacin, generar reclamos de alivio laxo por debajo del nivel ptimo o conducir a altas tasas de incumplimiento.",5
"As, donde la vivienda est altamente segregada, las escuelas tambin tienden a estar segregadas. Las escuelas que se perciben como de mejor calidad a menudo estn ubicadas en reas donde los precios de las propiedades y los alquileres son ms altos. Por lo tanto, la educacin de buena calidad a menudo tiene un precio implcito en el mercado de la vivienda y es posible que los estudiantes inmigrantes de entornos socioeconmicos bajos no tengan acceso a ella (Field et al.,",4
"El Ministerio planea ahora implicarse ms a travs del proyecto ""Implantacin de Guas de Prctica Clnica en la asistencia cubierta por el seguro mdico pblico"", financiado por la UE y puesto en marcha a finales de 2013. El sistema de auditora interna de la calidad y el sistema de supervisin de la seguridad de los pacientes son obligatorios por ley, pero siguen sin aplicarse. No est claro hasta qu punto estas auditoras se traducen en procesos reales de mejora de la atencin al paciente.",3
"Aunque existen algunas variaciones en las definiciones detalladas que se utilizan, las siguientes descripciones ofrecen una indicacin til de cmo los trminos 'formal', 'no formal' e 'informal' se aplican comnmente a la educacin y el aprendizaje. El aprendizaje no formal tiene muchas manifestaciones, pero los ejemplos incluiran clases de alfabetizacin para adultos en las aldeas y la formacin de entrenadores en un club deportivo. El sitio web iSpot Nature ofrece un ejemplo en lnea de aprendizaje colaborativo y autodirigido donde los usuarios aprenden a identificar y apreciar la flora y la fauna compartiendo informacin en una comunidad en lnea (Recuadro 1.1).",4
"El sistema ingls de atencin a la salud mental, que opera predominantemente bajo el Servicio Nacional de Salud, pero tambin bajo Salud Pblica de Inglaterra y junto a las Autoridades Locales gubernamentales, se compone de atencin primaria y especializada (""atencin secundaria"" y ""atencin terciaria""), y atencin social. Es probable que la atención integral de la salud mental incluya también cierta intervención de los servicios de atención social, tanto de los servicios financiados y gestionados por Public Health England como de los servicios sociales locales gestionados por las Autoridades Locales. Los servicios de atención de salud mental financiados por el gobierno y gestionados por el estado se complementan a veces con servicios voluntarios y con servicios privados pagados por el NHS, especialmente para la atención de seguridad media y baja (véanse la sección 3.2 y la sección 4.3.ii).",3
"Aunque la financiacin pblica ha sufrido algunas reducciones debido a la crisis econmica, el gasto por alumno sigue estando por encima de la media de la OCDE. Las altas tasas de abandono escolar y desempleo juvenil requieren esfuerzos para consolidar las habilidades bsicas y adaptarse mejor a las necesidades del mercado laboral, centrndose en la calidad de la educacin y la provisin de educacin y formacin profesional. Al mismo tiempo, la calidad de los docentes y el liderazgo escolar se puede mejorar a travs de una formacin inicial y continua ms especfica.",4
"Los requisitos actuales del Plan, introducidos en 2013, incluyen objetivos regionales especficos, y también se definen varios objetivos a través de la lista de tarifas.  Health Japan 21"" establece un objetivo de prevención de enfermedades asociadas a los hábitos de la vida adulta. El cumplimiento de las directrices es voluntario y no está claro el impacto de su evolución en la calidad. Esto se debe a la falta de indicadores completos y procesables que apoyen la mejora de la calidad. ",3
"Basado en datos armonizados de rendimiento de estudiantes de 15 aos recopilados a nivel individual, el anlisis emprico muestra que, mientras que los pases nrdicos de Europa exhiben niveles relativamente bajos de desigualdad, Europa continental se caracteriza por altos niveles de desigualdad, en particular de segregacin escolar segn el nivel socioeconmico. -lneas econmicas- mientras que los pases anglosajones ocupan una posicin algo intermedia. A pesar de la dificultad de identificar adecuadamente la relacin causal, el anlisis de regresin entre pases proporciona informacin sobre el potencial de las polticas para explicar las diferencias observadas en la equidad en la educacin. Las polticas que permiten una mayor mezcla social estn asociadas con una menor segregacin socioeconmica escolar sin afectar el desempeo general.",5
"En la actualidad hay pocos indicadores que midan la calidad de la coordinacin asistencial. Sin una investigacin biomdica adecuada sobre la mejor manera de tratar a una persona con mltiples afecciones crnicas, ser difcil crear parmetros de calidad basados en pruebas. Como ya se ha sealado, es difcil elaborar directrices prcticas o parmetros de calidad para las personas con mltiples enfermedades crnicas. ",3
"Cabe preguntarse, sin embargo, si los alumnos con ms talento del pas asisten a estos centros, ya que los estudiantes desfavorecidos tienen un acceso ms limitado a las clases extraescolares para prepararse para la admisin. Adems, la proporcin de alumnos con mejores resultados en las evaluaciones internacionales sigue siendo muy pequea, mientras que un gran nmero se queda rezagado con respecto a sus compaeros de otros pases. Los sistemas educativos que mejoran ms rpidamente en PISA muestran que las mejoras en la parte superior e inferior de la escala de rendimiento pueden ir de la mano. ",4
